{
  "schema": "moontown.knowledge-domain-catalog.v1",
  "catalog_id": "moontown-wenyu-knowledge-domains",
  "version": 1,
  "seed": 20260727,
  "description": "Semantic domains and governed MoonBook portfolios for the sixteen registered Wenyu Valley buildings. This catalog binds knowledge and operating books to buildings without owning geometry, mutable book memory, agent execution, or visual state.",
  "policies": [
    {
      "id": "town-orchestration-v1",
      "version": 1,
      "template_id": "service-operations-book",
      "source_policy": "owner-ledger",
      "evidence_policy": "protocol-receipt-required",
      "cadence": "continuous",
      "cadence_ticks": 1,
      "quality_threshold": 90,
      "review_chain": ["mayor", "operator", "keeper"],
      "max_revision_rounds": 2,
      "schedule_tier": "realtime",
      "budget_class": "controlled",
      "completion_claim": "operational-record"
    },
    {
      "id": "governed-policy-v1",
      "version": 1,
      "template_id": "domain-research-book",
      "source_policy": "primary-sources",
      "evidence_policy": "primary-source-required",
      "cadence": "daily",
      "cadence_ticks": 24,
      "quality_threshold": 92,
      "review_chain": ["specialist", "independent-reviewer", "keeper", "operator"],
      "max_revision_rounds": 3,
      "schedule_tier": "daily",
      "budget_class": "standard",
      "completion_claim": "advisory-only"
    },
    {
      "id": "signal-monitor-v1",
      "version": 1,
      "template_id": "service-operations-book",
      "source_policy": "telemetry-first",
      "evidence_policy": "telemetry-provenance-required",
      "cadence": "hourly",
      "cadence_ticks": 4,
      "quality_threshold": 88,
      "review_chain": ["watcher", "operator", "mayor"],
      "max_revision_rounds": 1,
      "schedule_tier": "frequent",
      "budget_class": "minimal",
      "completion_claim": "operational-record"
    },
    {
      "id": "review-program-v1",
      "version": 1,
      "template_id": "project-review-book",
      "source_policy": "contractual-record",
      "evidence_policy": "source-linked",
      "cadence": "event-driven",
      "cadence_ticks": 4,
      "quality_threshold": 86,
      "review_chain": ["specialist", "independent-reviewer", "keeper", "owner"],
      "max_revision_rounds": 3,
      "schedule_tier": "on-demand",
      "budget_class": "standard",
      "completion_claim": "human-accepted"
    },
    {
      "id": "public-story-v1",
      "version": 1,
      "template_id": "story-publication-book",
      "source_policy": "mixed-reviewed",
      "evidence_policy": "rights-and-claims-required",
      "cadence": "daily",
      "cadence_ticks": 24,
      "quality_threshold": 90,
      "review_chain": ["publisher", "rights-reviewer", "keeper", "operator"],
      "max_revision_rounds": 2,
      "schedule_tier": "daily",
      "budget_class": "standard",
      "completion_claim": "publication-ready"
    },
    {
      "id": "private-resident-v1",
      "version": 1,
      "template_id": "private-resident-book",
      "source_policy": "privacy-scoped",
      "evidence_policy": "privacy-scoped",
      "cadence": "daily",
      "cadence_ticks": 24,
      "quality_threshold": 92,
      "review_chain": ["owner", "keeper"],
      "max_revision_rounds": 2,
      "schedule_tier": "daily",
      "budget_class": "minimal",
      "completion_claim": "private-memory"
    },
    {
      "id": "learning-cohort-v1",
      "version": 1,
      "template_id": "learning-book",
      "source_policy": "mixed-reviewed",
      "evidence_policy": "source-linked",
      "cadence": "weekly",
      "cadence_ticks": 168,
      "quality_threshold": 84,
      "review_chain": ["educator", "independent-reviewer", "keeper"],
      "max_revision_rounds": 2,
      "schedule_tier": "weekly",
      "budget_class": "standard",
      "completion_claim": "reviewed-synthesis"
    },
    {
      "id": "civic-salon-v1",
      "version": 1,
      "template_id": "civic-ledger-book",
      "source_policy": "protocol-derived",
      "evidence_policy": "protocol-receipt-required",
      "cadence": "event-driven",
      "cadence_ticks": 4,
      "quality_threshold": 86,
      "review_chain": ["facilitator", "independent-reviewer", "keeper"],
      "max_revision_rounds": 2,
      "schedule_tier": "frequent",
      "budget_class": "standard",
      "completion_claim": "reviewed-synthesis"
    },
    {
      "id": "research-watch-v1",
      "version": 1,
      "template_id": "domain-research-book",
      "source_policy": "primary-sources",
      "evidence_policy": "primary-source-required",
      "cadence": "daily",
      "cadence_ticks": 24,
      "quality_threshold": 86,
      "review_chain": ["specialist", "independent-reviewer", "keeper"],
      "max_revision_rounds": 3,
      "schedule_tier": "daily",
      "budget_class": "elevated",
      "completion_claim": "evidence-backed-research"
    },
    {
      "id": "talent-match-v1",
      "version": 1,
      "template_id": "market-intelligence-book",
      "source_policy": "privacy-scoped",
      "evidence_policy": "privacy-scoped",
      "cadence": "event-driven",
      "cadence_ticks": 4,
      "quality_threshold": 88,
      "review_chain": ["analyst", "keeper", "owner"],
      "max_revision_rounds": 2,
      "schedule_tier": "frequent",
      "budget_class": "standard",
      "completion_claim": "human-accepted"
    },
    {
      "id": "market-network-v1",
      "version": 1,
      "template_id": "market-intelligence-book",
      "source_policy": "contractual-record",
      "evidence_policy": "protocol-receipt-required",
      "cadence": "hourly",
      "cadence_ticks": 4,
      "quality_threshold": 86,
      "review_chain": ["analyst", "independent-reviewer", "keeper"],
      "max_revision_rounds": 2,
      "schedule_tier": "frequent",
      "budget_class": "standard",
      "completion_claim": "advisory-only"
    },
    {
      "id": "physical-handoff-v1",
      "version": 1,
      "template_id": "physical-handoff-book",
      "source_policy": "telemetry-first",
      "evidence_policy": "telemetry-provenance-required",
      "cadence": "event-driven",
      "cadence_ticks": 1,
      "quality_threshold": 94,
      "review_chain": ["engineer", "safety-reviewer", "operator", "keeper"],
      "max_revision_rounds": 2,
      "schedule_tier": "realtime",
      "budget_class": "controlled",
      "completion_claim": "human-accepted"
    }
  ],
  "domains": [
    {
      "domain_id": "town-operations",
      "title": "Town Operations",
      "icon": "🏛️",
      "building_id": "town-shell",
      "kind": "civic-core",
      "primary_book_id": "wenyu-town-shell",
      "policy_id": "town-orchestration-v1",
      "communication_scenario_ids": ["mayor-supervision"],
      "summary": "Town-wide orchestration, authority, evidence routing, recovery, and release readiness.",
      "books": [
        {"book_id":"wenyu-town-shell","title":"Town Shell Operations","question":"What requires mayor attention now, and what may proceed safely?","role":"owner","template_id":"service-operations-book","policy_id":"town-orchestration-v1","schedule_tier":"realtime","cadence_ticks":1,"tags":["town","orchestration","authority"],"source_policy":"owner-ledger","status":"active"},
        {"book_id":"town-runtime-supervision","title":"Runtime Supervision","question":"Which runs are progressing, stalled, or violating their declared envelope?","role":"orchestrator","template_id":"service-operations-book","policy_id":"town-orchestration-v1","schedule_tier":"realtime","cadence_ticks":1,"tags":["runtime","supervision","recovery"],"source_policy":"telemetry-first","status":"active"},
        {"book_id":"town-authority-ledger","title":"Authority Ledger","question":"Which requested effects have explicit authority, and which remain blocked?","role":"reviewer","template_id":"civic-ledger-book","policy_id":"town-orchestration-v1","schedule_tier":"frequent","cadence_ticks":4,"tags":["authority","approval","ledger"],"source_policy":"owner-ledger","status":"incubating"},
        {"book_id":"town-evidence-index","title":"Town Evidence Index","question":"Can every visible completion claim be traced to owner evidence?","role":"archivist","template_id":"civic-ledger-book","policy_id":"town-orchestration-v1","schedule_tier":"daily","cadence_ticks":24,"tags":["evidence","provenance","index"],"source_policy":"owner-ledger","status":"incubating"},
        {"book_id":"town-recovery-playbooks","title":"Recovery Playbooks","question":"What is the smallest reversible recovery for each known failure mode?","role":"operator","template_id":"service-operations-book","policy_id":"town-orchestration-v1","schedule_tier":"weekly","cadence_ticks":168,"tags":["recovery","restart","playbook"],"source_policy":"mixed-reviewed","status":"incubating"},
        {"book_id":"town-release-readiness","title":"Release Readiness","question":"Which evidence and review gates still prevent a trustworthy release?","role":"reviewer","template_id":"project-review-book","policy_id":"town-orchestration-v1","schedule_tier":"on-demand","cadence_ticks":4,"tags":["release","quality","review"],"source_policy":"contractual-record","status":"incubating"}
      ]
    },
    {
      "domain_id": "ai-policy-governance",
      "title": "AI Policy and Governance",
      "icon": "⚖️",
      "building_id": "policy-hall",
      "kind": "civic-core",
      "primary_book_id": "wenyu-policy-hall",
      "policy_id": "governed-policy-v1",
      "communication_scenario_ids": ["policy-hall-triage-desk"],
      "summary": "Official-source policy research, eligibility triage, governance controls, and cited public explanations.",
      "books": [